{
  "schema_version": "2.0.0",
  "event_id": "FWE-000000000001",
  "event_group": "FWG-000000000001",
  "source_domain": "fds",
  "status": "candidate",
  "geometry": {
    "scene_type": "tunnel",
    "coordinate_system": "right-handed-m",
    "dimensions_m": {"length": 100, "width": 10, "height": 5},
    "regions": [{"region_id": "R1", "description": "upstream", "bounds_m": [0, 25, 0, 10, 0, 5]}]
  },
  "controls": {
    "source_region": "R1",
    "hrr_profile": "medium_growth",
    "ventilation": {"mode": "longitudinal"},
    "extraction": null,
    "openings": null,
    "random_seed": 20260717,
    "intervention": null
  },
  "timeline": {"start_s": 0, "end_s": 120, "sample_interval_s": 1},
  "observations": {
    "structured": {"ref": "events/FWE-000000000001/structured.json", "format": "json", "variables": ["temperature", "soot"], "units_normalized": true},
    "images": null,
    "video": null
  },
  "ground_truth": {
    "labels": [{"name": "source_region", "value": "R1", "origin": "simulation_truth", "rule_version": null}]
  },
  "provenance": {
    "source_version": "pilot-unexecuted-fixture",
    "source_files": [{"opaque_ref": "source/0001", "sha256": "aaaaaaaaaaaaaaaaaaaaaaaaaaaaaaaaaaaaaaaaaaaaaaaaaaaaaaaaaaaaaaaa"}],
    "transform_version": "fireworld-event-0.1.0",
    "created_at": "2026-07-17T00:00:00Z",
    "fds": {
      "fds_version": "TBD-PILOT",
      "smokeview_version": "TBD-PILOT",
      "fdgen_version": "TBD-PILOT",
      "mesh": {"status": "TBD-PILOT"},
      "boundary_hash": "bbbbbbbbbbbbbbbbbbbbbbbbbbbbbbbbbbbbbbbbbbbbbbbbbbbbbbbbbbbbbbbb",
      "random_seed": 20260717,
      "input_sha256": "cccccccccccccccccccccccccccccccccccccccccccccccccccccccccccccccc",
      "log_ref": "logs/FWE-000000000001.log",
      "run_status": "success"
    }
  },
  "license": {
    "license_id": "NIST-generated-output-review-pending",
    "evidence_ref": "governance/licenses/fds.md",
    "citation": "NIST Fire Dynamics Simulator and FD-Gen",
    "allowed_uses": ["research", "evaluation", "derivation"],
    "redistribution": "unknown"
  }
}
